<?xml version="1.0" encoding="ISO-8859-1"?>

<KnockSequence  xmlns:xsi="http://www.w3.org/2001/XMLSchema-instance"
		xsi:noNamespaceSchemaLocation="KnockSequence.xsd">
	<id>2</id>
	<description>description of the knock sequence</description>
	<smokePackets>
		<min>0</min>
		<max>0</max>
	</smokePackets>
	<maxFakePayload>100</maxFakePayload>
	<actions>

		<closePort>
			<portNumber>4000</portNumber>
			<wait>0</wait>
			<timeout>0</timeout>
		</closePort>
		<!-- put here the actions to be executed server-side -->

	</actions>

	<packets>
		<!-- put here the packets of the knock sequence -->

	</packets>
</KnockSequence>
