<?xml version="1.0" encoding="ISO-8859-1"?>

<KnockSequence  xmlns:xsi="http://www.w3.org/2001/XMLSchema-instance"
		xsi:noNamespaceSchemaLocation="KnockSequence.xsd">
	<id>3</id>
	<description>description of the knock sequence</description>
	<smokePackets>
		<min>2</min>
		<max>20</max>
	</smokePackets>
	<maxFakePayload>100</maxFakePayload>
	<actions>

		<!-- put here the actions to be executed server-side -->

	</actions>

	<packets>

		<ICMPpacket>
			<type>8</type>
			<code>0</code>
			<data></data>
		</ICMPpacket>

<!-- put here the packets of the knock sequence -->

	</packets>
</KnockSequence>
