<?xml version="1.0" encoding="ISO-8859-1"?>

<KnockSequence  xmlns:xsi="http://www.w3.org/2001/XMLSchema-instance"
		xsi:noNamespaceSchemaLocation="KnockSequence.xsd">
	<id>8</id>
	<description>tutto ok</description>
	<smokePackets>
		<min>2</min>
		<max>33</max>
	</smokePackets>
	<maxFakePayload>2200</maxFakePayload>
	<actions>

		<openPort>
			<portNumber>4000</portNumber>
			<exclusive>true</exclusive>
			<wait>12</wait>
			<timeout>0</timeout>
		</openPort>

	</actions>
	
	<packets>
		<UDPpacket>
			<srcPortNumber>7000</srcPortNumber>
			<dstPortNumber>3000</dstPortNumber>
			<payload>ciao</payload>
		</UDPpacket>
		<UDPpacket>
			<srcPortNumber>7000</srcPortNumber>
			<dstPortNumber>3000</dstPortNumber>
			<payload>ciao</payload>
		</UDPpacket>

		<TCPpacket>
			<srcPortNumber>8000</srcPortNumber>
			<dstPortNumber>9000</dstPortNumber>
			<sequenceNumber>1</sequenceNumber>
			<ackNumber>2</ackNumber>
			<windowSize>50</windowSize>
			<flags>
				<ack>0</ack>
				<syn>1</syn>
				<fin>0</fin>
				<push>0</push>
				<reset>0</reset>
				<urgent>0</urgent>
			</flags>
			<payload>payload</payload>
		</TCPpacket>
		<TCPpacket>
			<srcPortNumber>5000</srcPortNumber>
			<dstPortNumber>4000</dstPortNumber>
			<sequenceNumber>3</sequenceNumber>
			<ackNumber>4</ackNumber>
			<windowSize>500</windowSize>
			<flags>
				<ack>0</ack>
				<syn>0</syn>
				<fin>0</fin>
				<push>1</push>
				<reset>0</reset>
				<urgent>0</urgent>
			</flags>
			<payload>ciao</payload>
		</TCPpacket>
		<ICMPpacket>
			<type>8</type>
			<code>1</code>
			<data>ciaociaociao</data>
		</ICMPpacket>
	</packets>
</KnockSequence>
